<!ELEMENT biblioteca (libro+)>
<!ELEMENT libro (titulo, autor, publicacion)>

<!ELEMENT titulo (#PCDATA)>
<!ELEMENT autor (#PCDATA)>
<!ELEMENT publicacion (#PCDATA)>